{"active_pr":null,"repository":"H234598/desinfect","schema_version":"1.0.0","source_plan_sha256":"aa50863cde1313a7039691b4ca596c1ab498d0fab0008da324de5cb69f12ffc4","summary":{"total":60,"offen":26,"in_arbeit":0,"im_review":0,"umgesetzt":33,"blockiert":1},"updated_at":"2026-08-25T02:38:01Z","work_packages":[{"id":"P00.1","title":"Revisionsblatt und Analysefreeze","status":"umgesetzt","branch":"agent/p00-governance-baseline","pr_number":1,"evidence":{"merge_sha":"c4996105f6d683c2c4d342df6ee43b74dbcb64a6","ci_runs":["github-actions:30331599906","CodeRabbit:success@c61581842415da4d5c2e81ae7e28fbe7f4165a8f","qlty:success@c61581842415da4d5c2e81ae7e28fbe7f4165a8f"],"tests":["python3 scripts/validate_all_baseline.py","python3 -m unittest discover -s tests -p \"test_*.py\"","python3 -m compileall -q scripts tests"],"requirement_ids":["V2-01-ARCH-001","V2-02-ARCH-001","V2-02-ARCH-002","V2-02-ARCH-003","V2-02-ARCH-004","V2-02-ARCH-005","V2-02-ARCH-006","V2-25-DOCS-001","V2-25-DOCS-002","V2-25-DOCS-003","V2-25-DOCS-004","V2-25-DOCS-005","V2-27-PHASE-001","V2-27-PHASE-002","V2-27-PHASE-003","V2-27-PHASE-004","V2-27-PHASE-005","V2-29-SUMMARY-001","V2-30-SOURCE-001","MUSS-04","MUSS-26"],"accepted_at":"2026-07-28T05:34:53Z","accepted_by":"H234598","notes":"PR #1 wurde mit erwartetem Head-SHA gesquasht; GitHub Actions, CodeRabbit und qlty waren grün; alle Reviewthreads waren aufgelöst."}},{"id":"P00.2","title":"Anforderungs- und Entscheidungstraceability","status":"umgesetzt","branch":"agent/p00-governance-baseline","pr_number":1,"evidence":{"merge_sha":"c4996105f6d683c2c4d342df6ee43b74dbcb64a6","ci_runs":["github-actions:30331599906","CodeRabbit:success@c61581842415da4d5c2e81ae7e28fbe7f4165a8f","qlty:success@c61581842415da4d5c2e81ae7e28fbe7f4165a8f"],"tests":["python3 scripts/validate_all_baseline.py","python3 -m unittest discover -s tests -p \"test_*.py\"","python3 -m compileall -q scripts tests"],"requirement_ids":["V2-01-ARCH-001","V2-02-ARCH-001","V2-02-ARCH-002","V2-02-ARCH-003","V2-02-ARCH-004","V2-02-ARCH-005","V2-02-ARCH-006","V2-25-DOCS-001","V2-25-DOCS-002","V2-25-DOCS-003","V2-25-DOCS-004","V2-25-DOCS-005","V2-27-PHASE-001","V2-27-PHASE-002","V2-27-PHASE-003","V2-27-PHASE-004","V2-27-PHASE-005","V2-29-SUMMARY-001","V2-30-SOURCE-001","MUSS-04","MUSS-26"],"accepted_at":"2026-07-28T05:34:53Z","accepted_by":"H234598","notes":"PR #1 wurde mit erwartetem Head-SHA gesquasht; GitHub Actions, CodeRabbit und qlty waren grün; alle Reviewthreads waren aufgelöst."}},{"id":"P00.3","title":"Fortschritts- und Evidenzvertrag","status":"umgesetzt","branch":"agent/p00-governance-baseline","pr_number":1,"evidence":{"merge_sha":"c4996105f6d683c2c4d342df6ee43b74dbcb64a6","ci_runs":["github-actions:30331599906","CodeRabbit:success@c61581842415da4d5c2e81ae7e28fbe7f4165a8f","qlty:success@c61581842415da4d5c2e81ae7e28fbe7f4165a8f"],"tests":["python3 scripts/validate_all_baseline.py","python3 -m unittest discover -s tests -p \"test_*.py\"","python3 -m compileall -q scripts tests"],"requirement_ids":["V2-01-ARCH-001","V2-02-ARCH-001","V2-02-ARCH-002","V2-02-ARCH-003","V2-02-ARCH-004","V2-02-ARCH-005","V2-02-ARCH-006","V2-25-DOCS-001","V2-25-DOCS-002","V2-25-DOCS-003","V2-25-DOCS-004","V2-25-DOCS-005","V2-27-PHASE-001","V2-27-PHASE-002","V2-27-PHASE-003","V2-27-PHASE-004","V2-27-PHASE-005","V2-29-SUMMARY-001","V2-30-SOURCE-001","MUSS-04","MUSS-26"],"accepted_at":"2026-07-28T05:34:53Z","accepted_by":"H234598","notes":"PR #1 wurde mit erwartetem Head-SHA gesquasht; GitHub Actions, CodeRabbit und qlty waren grün; alle Reviewthreads waren aufgelöst."}},{"id":"P01.1","title":"Python-/Node-Paketfundament","status":"umgesetzt","branch":"agent/p01-foundation","pr_number":3,"evidence":{"merge_sha":"4fc4aca667ce1b7a9529cc49e4e81fc373f75da2","ci_runs":["github-actions:30336885794","CodeRabbit:success@a0b6d26ee91ba0e1c6d531c6b7fd2ab6058393aa","qlty:success@a0b6d26ee91ba0e1c6d531c6b7fd2ab6058393aa"],"tests":["python3 scripts/validate_all_baseline.py","python3 scripts/validate_p01_foundation.py","python3 -m compileall -q scripts tests","python3 -m unittest discover -s tests -p \"test_*.py\"","python3 -m pytest -q","npm test"],"requirement_ids":["V2-03-TREE-001","V2-03-TREE-002","V2-03-TREE-003","V2-03-TREE-004","V2-03-TREE-005","V2-26-TEST-001","V2-26-TEST-002","V2-26-TEST-003","V2-26-TEST-004","V2-26-TEST-005","V2-26-TEST-006","V2-26-TEST-007","V2-26-TEST-008"],"accepted_at":"2026-07-28T07:05:33Z","accepted_by":"H234598","notes":"PR #3 wurde per Squash mit erwartetem Head a0b6d26ee91ba0e1c6d531c6b7fd2ab6058393aa gemergt; GitHub Actions, CodeRabbit und qlty waren grün; alle Reviewthreads waren aufgelöst."}},{"id":"P01.2","title":"Sichere Datei-, Hash- und Stagingprimitive","status":"umgesetzt","branch":"agent/p01-foundation","pr_number":3,"evidence":{"merge_sha":"4fc4aca667ce1b7a9529cc49e4e81fc373f75da2","ci_runs":["github-actions:30336885794","CodeRabbit:success@a0b6d26ee91ba0e1c6d531c6b7fd2ab6058393aa","qlty:success@a0b6d26ee91ba0e1c6d531c6b7fd2ab6058393aa"],"tests":["python3 scripts/validate_all_baseline.py","python3 scripts/validate_p01_foundation.py","python3 -m compileall -q scripts tests","python3 -m unittest discover -s tests -p \"test_*.py\"","python3 -m pytest -q","npm test"],"requirement_ids":["V2-03-TREE-001","V2-03-TREE-002","V2-03-TREE-003","V2-03-TREE-004","V2-03-TREE-005","V2-26-TEST-001","V2-26-TEST-002","V2-26-TEST-003","V2-26-TEST-004","V2-26-TEST-005","V2-26-TEST-006","V2-26-TEST-007","V2-26-TEST-008"],"accepted_at":"2026-07-28T07:05:33Z","accepted_by":"H234598","notes":"PR #3 wurde per Squash mit erwartetem Head a0b6d26ee91ba0e1c6d531c6b7fd2ab6058393aa gemergt; GitHub Actions, CodeRabbit und qlty waren grün; alle Reviewthreads waren aufgelöst."}},{"id":"P01.3","title":"Offline-Fixtures und Testdatenpolicy","status":"umgesetzt","branch":"agent/p01-foundation","pr_number":3,"evidence":{"merge_sha":"4fc4aca667ce1b7a9529cc49e4e81fc373f75da2","ci_runs":["github-actions:30336885794","CodeRabbit:success@a0b6d26ee91ba0e1c6d531c6b7fd2ab6058393aa","qlty:success@a0b6d26ee91ba0e1c6d531c6b7fd2ab6058393aa"],"tests":["python3 scripts/validate_all_baseline.py","python3 scripts/validate_p01_foundation.py","python3 -m compileall -q scripts tests","python3 -m unittest discover -s tests -p \"test_*.py\"","python3 -m pytest -q","npm test"],"requirement_ids":["V2-03-TREE-001","V2-03-TREE-002","V2-03-TREE-003","V2-03-TREE-004","V2-03-TREE-005","V2-26-TEST-001","V2-26-TEST-002","V2-26-TEST-003","V2-26-TEST-004","V2-26-TEST-005","V2-26-TEST-006","V2-26-TEST-007","V2-26-TEST-008"],"accepted_at":"2026-07-28T07:05:33Z","accepted_by":"H234598","notes":"PR #3 wurde per Squash mit erwartetem Head a0b6d26ee91ba0e1c6d531c6b7fd2ab6058393aa gemergt; GitHub Actions, CodeRabbit und qlty waren grün; alle Reviewthreads waren aufgelöst."}},{"id":"P02.1","title":"Schemafamilie und Versionsstrategie","status":"umgesetzt","branch":"agent/p02-data-contracts","pr_number":5,"evidence":{"merge_sha":"947b2ba86792d5a84e0f2fd972cfbe554c156afc","ci_runs":["github-actions:30342761383","CodeRabbit:success@923975c7ba81dc73f68d838b85b8b5fdcbe05e72","qlty:success@923975c7ba81dc73f68d838b85b8b5fdcbe05e72"],"tests":["python3 scripts/validate_all_baseline.py","python3 scripts/validate_p01_foundation.py","python3 scripts/validate_p02_contracts.py","python3 -m scripts.rki_pipeline.runtime_status_cli --help","python3 -m compileall -q scripts tests","python3 -m unittest discover -s tests -p \"test_*.py\"","python3 -m pytest -q","npm test"],"requirement_ids":["MUSS-07","MUSS-08"],"accepted_at":"2026-07-28T08:34:46Z","accepted_by":"H234598","notes":"PR #5 wurde per Squash mit erwartetem Head 923975c7ba81dc73f68d838b85b8b5fdcbe05e72 gemergt; GitHub Actions, CodeRabbit und qlty waren grün; alle neun Reviewthreads waren aufgelöst."}},{"id":"P02.2","title":"Öffentlicher Status und Lauf-/Recovery-Modell","status":"umgesetzt","branch":"agent/p02-data-contracts","pr_number":5,"evidence":{"merge_sha":"947b2ba86792d5a84e0f2fd972cfbe554c156afc","ci_runs":["github-actions:30342761383","CodeRabbit:success@923975c7ba81dc73f68d838b85b8b5fdcbe05e72","qlty:success@923975c7ba81dc73f68d838b85b8b5fdcbe05e72"],"tests":["python3 scripts/validate_all_baseline.py","python3 scripts/validate_p01_foundation.py","python3 scripts/validate_p02_contracts.py","python3 -m scripts.rki_pipeline.runtime_status_cli --help","python3 -m compileall -q scripts tests","python3 -m unittest discover -s tests -p \"test_*.py\"","python3 -m pytest -q","npm test"],"requirement_ids":["MUSS-07","MUSS-08"],"accepted_at":"2026-07-28T08:34:46Z","accepted_by":"H234598","notes":"PR #5 wurde per Squash mit erwartetem Head 923975c7ba81dc73f68d838b85b8b5fdcbe05e72 gemergt; GitHub Actions, CodeRabbit und qlty waren grün; alle neun Reviewthreads waren aufgelöst."}},{"id":"P02.3","title":"Automatische Schreibpfad-Policy","status":"umgesetzt","branch":"agent/p02-data-contracts","pr_number":5,"evidence":{"merge_sha":"947b2ba86792d5a84e0f2fd972cfbe554c156afc","ci_runs":["github-actions:30342761383","CodeRabbit:success@923975c7ba81dc73f68d838b85b8b5fdcbe05e72","qlty:success@923975c7ba81dc73f68d838b85b8b5fdcbe05e72"],"tests":["python3 scripts/validate_all_baseline.py","python3 scripts/validate_p01_foundation.py","python3 scripts/validate_p02_contracts.py","python3 -m scripts.rki_pipeline.runtime_status_cli --help","python3 -m compileall -q scripts tests","python3 -m unittest discover -s tests -p \"test_*.py\"","python3 -m pytest -q","npm test"],"requirement_ids":["MUSS-07","MUSS-08"],"accepted_at":"2026-07-28T08:34:46Z","accepted_by":"H234598","notes":"PR #5 wurde per Squash mit erwartetem Head 923975c7ba81dc73f68d838b85b8b5fdcbe05e72 gemergt; GitHub Actions, CodeRabbit und qlty waren grün; alle neun Reviewthreads waren aufgelöst."}},{"id":"P03.1","title":"Grabber in Parser, HTTP und Orchestrierung schneiden","status":"umgesetzt","branch":"agent/p03-grabber-modularization","pr_number":7,"evidence":{"merge_sha":"e180b20788072bba840e655d493bac73c7f1a3ee","ci_runs":[